"AUTEURSENAUTEURSFUNCTIES","DOCUMENTCODE","DRUK","EMBARGODATUM","ISBN13EAN","ISBNFOLIOBK","JAARVANUITGAVE","MEDIAPRODUCTFAMILY","NAAMVANUITGEVER","NUMMER","OMVANG","ONDERTITEL","PLAATSVANUITGAVE","PRIJS","PRODUCTSTATUS","PRODUCTTEKST","RUBRIEKCODE","RUBRIEKSOMSCHRIJVING","RUBRIEKSOMSCHRIJVING2","RUBRIEKSOMSCHRIJVING3","SAMENVATTINGABSTRACT","SERIENRCQREEKSNR","SERIETITELCQREEKSTITEL","TITEL","VERSCHIJNINGSDATUM","WIJZIGINGSDATUM","WIJZIGINGSSTATUS"
"Drongelen, J. van|Fase †, W.J.P.M. ","gereed","9","","9789462511835","9789462511835","2018","","Paris","","453","De overeenkomsten tot het verrichten van arbeid – Vakantie en verlof","Zutphen","42.20","Final","","825","Arbeids- en sociale zekerheidsrecht","","","Dit boek is het eerste deel van een drieluik, waarin alle facetten van de individuele arbeidsverhouding worden behandeld. In ‘Individueel Arbeidsrecht Deel 1’ komen overeenkomsten tot het verrichten van arbeid en vakantie en verlof aan de orde. Veel aandacht is geschonken aan parlementaire stukken, literatuur en rechtspraak, zodat deze uitgave naast een leerboek ook een zeer nuttig naslagwerk is voor de praktijk. Individueel Arbeidsrecht Deel 1 is hiermee een van de meest uitgebreide uitgaven op dit gebied in de Nederlandse rechtsliteratuur. Om de toegankelijkheid van de uitgave te vergroten is een fijnmazige hoofdstukindeling gehanteerd, zodat een bepaald onderwerp snel is terug te vinden. Voor zover dit nuttig is, wordt bij de onderwerpsgewijze behandeling verwezen naar andere onderdelen van het boek.","1","Individueel arbeidsrecht","Individueel Arbeidsrecht Deel 1 ","13-08-2018","24-12-2020","Gewijzigd"
"Drongelen, J. van|Fase †, W.J.P.M.|Jellinghaus, S.F.H.","gereed","8","","9789462511842","9789462511842","2018","","Paris","","511","Ontslagrecht","Zutphen","42.20","Final","","825","Arbeids- en sociale zekerheidsrecht","","","Dit boek is het derde deel van een drieluik waarin alle facetten van de individuele arbeidsverhouding worden behandeld. Het is daarmee een van de meest uitgebreide uitgaven op dit gebied in de Nederlandse rechtsliteratuur. In ‘Individueel arbeidsrecht Deel 3’ komt het ontslagrecht aan de orde. Het ontslagrecht is met ingang van 1 juli 2015 door de Wet werk en zekerheid ingrijpend gewijzigd. Deze wet en de daarop berustende nadere voorschriften worden in dit boek uitgebreid behandeld en waar nodig van commentaar voorzien. Aan bod komen allereerst de beëindiging met wederzijds goedvinden (beëindigingsovereenkomst) en van rechtswege. Vervolgens worden de ontslaggronden, de beëindiging door opzegging al dan niet met toestemming van het UWV of de cao-ontslagcommissie, de beëindiging door onverwijlde opzegging wegens dringende reden (het ontslag op staande voet) en de opzeg-/beëindigingsverboden behandeld. Daarna komen de ontbinding door de kantonrechter, het herstel van de arbeidsovereenkomst en de vergoedingen in samenhang met het ontslag aan de orde. Het ontslagrecht wordt afgesloten door procedurele aspecten (verzoekschrift, hoger beroep en cassatie). Als laatste wordt het getuigschrift behandeld. Veel aandacht is geschonken aan parlementaire stukken, literatuur en rechtspraak, zodat de uitgave naast een leerboek ook een zeer nuttig naslagwerk is voor de praktijk.","3","Individueel arbeidsrecht","Individueel Arbeidsrecht Deel 3 ","17-08-2018","24-12-2020","Gewijzigd"
"Mosselman, M.W.","gereed","","","9789462511712","9789462511712","2018","","Paris","","506","Second edition","Zutphen","59.17","Final","","822","Privaatrecht","","","This book covers the most important legal issues when conducting business abroad. The first part covers European law with a focus on the institutions of the European Union, the four freedoms and competition law. The second part focuses on individual international contracts. This part starts with the legal environment of the business transaction. The political and policy risks of doing business abroad are explained, as well as how they should be addressed. It continues with entry strategies in foreign markets and then goes on to focus on the individual contract of sale. A wide range of subjects are covered, including general conditions of sale, retention of title, the CISG, product safety and product liability, Incoterms, contract of carriage, jurisdiction, choice of law and arbitration, standard contract clauses and payment conditions. This book takes a practical approach and contains examples and exercises. The book does not pretend to be the ultimate guide: the field of international commercial law in particular is vast, and has many different angels. However, it does try to explain the main pitfalls of doing business in foreign countries and how to avoid them.","","","Introduction to International Commercial and European Law","29-06-2018","24-12-2020","Gewijzigd"
"Hart, F.M.A. 't|Loonen, A.J.C.C.M.","gereed","","","9789462511675","9789462511675","2018","","Paris","","227","Vanuit praktijk en theorie bezien","Zutphen","39.91","Final","","827","Ondernemingsrecht","","","Onder MiFID II worden beleggingsondernemingen geconfronteerd met nieuwe verplichtingen. Deze variëren van rapportageverplichtingen, eisen ten aanzien van product governance en maatregelen om de belangen van consumenten beter te kunnen beschermen. Dit boek is samengesteld door experts die technisch uiteenzetten wat de verplichtingen behelzen, maar ook ingaan op de implicaties voor de dagelijkse praktijk. Hierdoor is het een waardevol naslagwerk geworden voor compliance officers, toezichthouders, bankjuristen, advocaten en rechterlijke macht. Dr. mr. F.M.A.  't Hart is compagnon van Hart advocaten. Hart advocaten is een gespecialiseerd advocatenkantoor voor financiële ondernemingen en houdt zich uitsluitend bezig met financieel recht. 't Hart is rechter-plaatsvervanger bij de fraudekamer van de rechtbank Gelderland. Daarnaast doceert en publiceert hij regelmatig over het financieel recht en is hij redacteur van (juridische) boekenseries en tijdschriften. Prof. dr. A.J.C.C.M. Loonen is werkzaam als directeur Private Banking bij InsingerGilissen Bankiers N.V. Daarnaast is hij hoogleraar aan de postgraduate opleiding Investment Management van de School of Business and Economics, Vrije Universiteit Amsterdam. Hier doceert hij Compliance en wet- en regelgeving voor beleggingsondernemingen. Tevens doceert hij Ethiek en Corporate Governance aan de UvA. Hij is lid van de Tuchtcommissie Banken.","13","Financieel Juridische Reeks","MiFID II","22-03-2018","24-12-2020","Gewijzigd"
"Pennings, Frans (red.)|Plantenga, Janneke (red.)","gereed","","","9789462511781","9789462511781","2018","","Paris","","195","","Zutphen","35.32","Final","","825","Arbeids- en sociale zekerheidsrecht","","","De arbeidsmarkt is sterk in ontwikkeling. De vertrouwde fulltimebanen maken steeds meer plaats voor tijdelijke banen of andere vormen van flexibele arbeid. Mensen werken minder vaak op een vaste locatie en een vast tijdstip. Daarnaast moeten ze regelmatig een periode wijden aan zorgtaken of aan bijscholing. Deze ontwikkelingen maken het nodig om te denken over nieuwe vormen van sociale bescherming. Daarvoor biedt dit boek veel informatie. De effecten van nieuwe arbeidspatronen op de loopbanen van de werkenden worden beschreven en het boek gaat in op de vraag of en op welke wijze sociale bescherming kan worden georganiseerd. Is het stimuleren van private spaarvormen een mogelijkheid? Of moet de maatschappij meer investeren in publieke arrangementen om de combinatie van werk en (mantel)zorg mogelijk te maken? In dit boek komen zowel de juridische als de economische dimensies van deze vragen aan de orde. Het geeft daarmee een actueel en veelzijdig beeld van de ontwikkelingen op de Nederlandse arbeidsmarkt.","","","Nieuwe vormen van arbeidsrelaties en sociale bescherming","02-07-2018","24-12-2020","Gewijzigd"
"Engel, Kees","gereed","","","9789462511859","9789462511859","2018","","Paris","","116","","Zutphen","18.35","Final","","820","Recht algemeen","","","Een rechter die een muntje opgooit, een man die meerdere rechters wraakt vanwege hun voorletters, de vraag of een ondiepe kuil in een bos als woning moet worden aangemerkt en een geschil over de waarde van een genuttigd diner. Ook uit dit tweede deel van 33 bijzondere, humoristische en opvallende rechterlijke uitspraken blijkt dat rechtspreken, hoewel een serieuze aangelegenheid, veel amusante en soms zelfs hilarische momenten kan opleveren. Het boek is daarmee een ideaal cadeau voor advocaten, rechters, juridisch medewerkers, rechtenstudenten en andere juridisch geïnteresseerden.","","","Nog 33 bijzondere, humoristische en opvallende rechterlijke uitspraken","10-09-2018","24-12-2020","Gewijzigd"
"Plate CPC, Dirk-Jan","gereed","","","9789462511682","9789462511682","2018","","Paris","","106","Gevolgen en mogelijkheden uitgebreid behandeld","Zutphen","21.56","Final","","825","Arbeids- en sociale zekerheidsrecht","","","Pensioen is een belangrijk onderdeel van het totale arbeidsvoorwaardenpakket. Toch krijgen bij een individueel ontslag of reorganisatie de gevolgen en mogelijkheden voor het pensioen weinig aandacht. Vragen als 'Wat zijn de gevolgen mocht er geen actie worden ondernomen?' en 'Welke voordelen kunnen er worden behaald als er juist wel tot actie wordt overgegaan?' worden in dit boek beantwoord. De antwoorden houden rekening met alle rechtsgebieden en zijn uitvoerig onderbouwd met de bijbehorende wetsartikelen, literatuur en jurisprudentie. Ondersteund met een groot aantal praktijkvoorbeelden bieden de informatie en de besproken oplossingsconstructies een handelingsperspectief voor de ontslagpraktijk. Dirk-Jan Plate CPC is zelfstandig adviseur met veel ervaring op het gebied van reorganisaties bij zowel kleine als grote bedrijven en overheidsinstellingen.","","","Pensioenoplossingen bij ontslag","29-03-2018","24-12-2020","Gewijzigd"
"Roest, O.A.P. van der","gereed","3","","9789462511767","9789462511767","2018","","Paris","","252","Een korte uitleg","Zutphen","33.03","Final","","820","Recht algemeen","","","Recht & Interpretatie is bedoeld als inleidend (leer)boek. Op een toegankelijke wijze kunnen geïnteresseerden kennismaken met het werk van de jurist. Er is aandacht voor onder andere historie, natuurrecht, ethiek, codificatiegeschiedenis en interpretatiemethoden. Ook wordt ingegaan op de motivering en legitimiteit van een juridisch(e) beslissing en advies, de stappen die genomen moeten worden bij de beantwoording van een rechtsvraag en de fasen in een juridisch kwalitatief onderzoek. Elk hoofdstuk wordt afgesloten met enkele praktische of theoretische opdrachten en het boek wordt afgesloten met een formatieve eindtoets. De antwoorden staan achterin het boek.","","","Recht & Interpretatie ","12-06-2018","24-12-2020","Gewijzigd"
"Winkelhorst, R.C.","gereed","","","9789462511729","9789462511729","2018","","Paris","","234","De robotisering van de maatschappij in praktisch, juridisch en maatschappelijk perspectief","Zutphen","50.46","Final","","820","Recht algemeen","","","‘Bloemen houden van mensen, haal ze in huis’ groeide in de jaren zeventig uit tot een razend populaire verkoopslogan van de bloemensector. Voor de robots zag het leven er destijds veel minder florissant uit. Afgeschermd van de mens, deden de eerste Robo sapiens louter zwaar en geestdodend fabriekswerk. Hierin kwam verandering toen eind jaren negentig een van hen de schaaklegende Kasparov versloeg en het robotbrein bestaansrecht werd toegedicht. Inmiddels is de robotisering van de maatschappij in volle gang en valt deze ook de mens ten deel. Dit leidt niet alleen tot nieuwe mogelijkheden, maar werpt evenzoveel vragen en maatschappelijke uitdagingen op. Niet in de laatste plaats door een mondiaal gebrek aan adequate normen en een definitie van de robot. Of robots op dezelfde wijze als bloemen, of misschien wel daadwerkelijk, van mensen zullen gaan houden is uiteraard nog maar de vraag. Sommigen vrezen dat de huidige invasie leidt tot de totale omverwerping van onze samenleving. Het in huis halen van het boek Robot-is-me? is gelukkig relatief veilig en brengt u dichter bij een antwoord.","","","Robot-is-me?","06-07-2018","24-12-2020","Gewijzigd"
"Braat, Bram","gereed","","","9789462511774","9789462511774","2018","","Paris","","299","Towards an Optimum of Overall Competition Law Enforcement?","Zutphen","65.14","Final","","828","Internationaal (publiek)recht","","","The difficulty with competition law is that so many aspects can influence its overall effectiveness. Sanctions in criminal law or the emergence of private enforcement, for example, may influence leniency policy. In turn, public enforcement, whilst protecting information, could also influence the effectiveness of antitrust damages actions. The author makes a comparison with the board game “Pisa”. In this game, small figures have to be placed at different levels of the Leaning Tower of Pisa, with the aim of keeping the tower stable. When there are too many dolls on one side and not enough on the other, the balance is lost and the figures topple off the tower. Competition law enforcement is a leaning tower of Pisa. If the structure of a competition law policy is not sufficiently balanced between public and private enforcement, it will function less effectively than it could. With an upcoming private enforcement it is important to strike the right balance so that claimants are able to effectively claim damages on the one hand, but cartel infringers remain interested in applying for leniency on the other. The author analyzes the chosen systems of the EU, Germany and the Netherlands and uses the US system as inspiration. The author also discusses potential solutions for diverging approaches.","","","The Relation Between Leniency and Private Enforcement","03-07-2018","24-12-2020","Gewijzigd"
"Lamers, A.H. ","gereed","","","9789462511743","9789462511743","2018","","Paris","","62","","Zutphen","19.72","Final","","822","Privaatrecht","","","Het leerstuk van de samenhangende rechtsverhoudingen in het overeenkomstenrecht is wellicht het beste voorbeeld van de omstandigheid dat de grenzen van het civil law contractenrecht onder druk staan. De verbonden overeenkomsten zijn overeenkomsten die een zodanige invloed op elkaar uitoefenen dat een wijziging binnen de ene overeenkomst niet zonder gevolgen kan blijven voor een ‘verbonden’ andere overeenkomst. Deze osmotische werking tussen twee of meerdere overeenkomsten verhoudt zich slecht met de heersende doctrine waarin de beslotenheid van de overeenkomst vooropstaat. Dat wil zeggen dat alleen partijen bij een overeenkomst directe invloed kunnen uitoefenen op de rechtssfeer van die overeenkomst en dat derden die niet direct als partij betrokken zijn bij die overeenkomst, geen invloed kunnen uitoefenen op de rechtsgevolgen van die overeenkomst. In dit boek wordt de ontwikkeling van het leerstuk verbonden overeenkomsten in de rechtspraak geschetst. Daarbij worden enerzijds kritische noten geplaatst en anderzijds openingen onderzocht die wellicht als handvat kunnen dienen in een toekomstig codificatieproces.","24","NTHR-Reeks","Verbonden overeenkomsten in het handelsrecht","14-05-2018","24-12-2020","Gewijzigd"
"Roest (red.), O.A.P. van der|Azimi, A.|Dam, R.J. van|Harmsen, M.","gereed","","","9789462511811","9789462511811","2018","","Paris","","247","","Zutphen","23.39","Final","","823","Staats- en bestuursrecht","","","Dit werkboek bevat formatieve toetsen (casus, uitspraken en vragen) en checklists. De vragen hebben betrekking op meerdere belangrijke onderwerpen van het algemeen bestuursrecht. Aan de orde komen de kernbegrippen van de Awb (bestuursorganen, belanghebbenden en besluiten), toekenning van bestuursbevoegdheid (attributie, delegatie en mandaat), normen voor het handelen van bestuursorganen (algemeen verbindende voorschriften en algemene beginselen van behoorlijk bestuur), handhaving (last onder bestuursdwang, last onder dwangsom en bestuurlijke boete) en gedogen, schadevergoeding bij onrechtmatige besluiten, nadeelcompensatie, overheid en privaatrecht alsmede rechtsbescherming (bezwaar, administratief beroep, beroep, hoger beroep en voorlopige voorziening). Het werkboek biedt voor studenten die zich voorbereiden op het tentamen algemeen bestuursrecht een goede ondersteuning. In het boek zijn aan het einde van elk hoofdstuk op docerende wijze antwoorden opgenomen. Het werkboek is geschikt voor het hoger juridisch onderwijs met collegecycli van verschillende omvang en intensiteit. Ook voor de praktijkjurist is het werkboek van belang. De aansprekende formatieve toetsen zijn aan de praktijk ontleend. De checklists bieden een handzaam hulpmiddel bij de voorbereiding op het tentamen algemeen bestuursrecht alsmede voor wie in de bestuursrechtelijke praktijk werkzaam is. Het boek is een resultaat van jarenlange ervaring van de auteurs in de praktijk en/of het onderwijs.","","","Werkboek Algemeen bestuursrecht","13-06-2018","24-12-2020","Gewijzigd"
"Drongelen, J. van (red.)","gereed","","","9789462511750","9789462511750","2018","","Paris","","277","Parlementaire geschiedenis arbeidsrecht deel 7","Zutphen","45.87","Final","","825","Arbeids- en sociale zekerheidsrecht","","","Misbruik van de bereidheid van arbeidskrachten, bijvoorbeeld uit andere lidstaten van de Europese Unie (EU), Europese Economische Ruimte (EER) en Zwitserland, om voor een lager loon te werken dan het toepasselijk minimumloon, leidt tot oneerlijke concurrentie tussen bedrijven en aan werknemerskant tot verdringing, onderbetaling en soms zelfs uitbuiting. Als gevolg van het verdringingseffect staat het Nederlandse sociale zekerheidsstelsel onder druk. Om aan deze ongewenste situatie(s) zowel aan de kant van de bedrijven als aan werknemerskant iets te kunnen doen, is de Wet aanpak schijnconstructies tot stand gebracht. Deze wet behandelt oneerlijke concurrentie tussen bedrijven, het versterken van de rechtspositie van werknemers en een beloning voor werknemers. In dit boek wordt de parlementaire geschiedenis van die wet behandeld. Een wijziging in een wettelijk voorschrift wordt voorafgegaan door de oude (te wijzigen) wettekst. Het wijzigingsonderdeel sluit af met het wettelijk voorschrift waarin de wijzigingen zijn aangebracht. Daarbij is de volgorde aangehouden van de parlementaire behandeling. In de marge is aangegeven welk onderdeel van de parlementaire behandeling aan de orde is.","7","Parlementaire geschiedenis arbeidsrecht","Wet aanpak schijnconstructies","17-05-2018","24-12-2020","Gewijzigd"
"Drongelen, J. van (red.)","gereed","","","9789462511644","9789462511644","2018","","Paris","","151","Parlementaire geschiedenis arbeidsrecht deel 6","Zutphen","39.91","Final","","825","Arbeids- en sociale zekerheidsrecht","","","De Wet minimumloon en minimumvakantiebijslag (Wml) is in 1968 tot stand gebracht als een zuiver civielrechtelijke wet met als oogmerk de werknemer een loon te garanderen als aanvaardbare tegenprestatie voor de verrichte arbeid. In 2007 is de bestuurlijke boete als handhavingsinstrument van de overheid ingevoerd als uitvloeisel van een veranderde invulling van de betekenis van de Wml. Met het openstellen van de grenzen in mei 2007 voor de zogenoemde MOE-landers is het zwaartepunt verschoven naar oneerlijke concurrentie, wat kan worden gezien als een verschuiving van de werknemers naar de onderneming. De bestuursrechtelijke handhaving van de wet blijkt een nachtmerrie te zijn voor de toezichthoudende instantie, de Arbeidsinspectie (thans: Inspectie SZW). De handhavingsproblemen zijn telkens opgelost met aanpassing van de wetgeving. In dit boekje wordt de parlementaire geschiedenis van een van deze wijzigingswetten behandeld. Een wijziging in een wettelijk voorschrift wordt voorafgegaan door de oude (te wijzigen) wettekst. Het wijzigingsonderdeel sluit af met het wettelijk voorschrift waarin de wijzigingen zijn aangebracht. Daarbij is de volgorde aangehouden van de parlementaire behandeling. In de marge is aangegeven welk onderdeel van de parlementaire behandeling aan de orde is.","6","Parlementaire geschiedenis arbeidsrecht","Wijziging Wet minimumloon en minimumvakantiebijslag in verband met de verlaging van de leeftijd waarop men recht heeft op het volwassenminimumloon, in verband met stukloon en meerwerk en enige andere wijzigingen","17-05-2018","24-12-2020","Gewijzigd"
"Rank, W.AK.","gereed","","","9789462511910","9789462511910","2018","","Paris","","187","","Zutphen","34.86","Final","","820","Recht algemeen","","","De eerste druk van Vermogensscheiding in de financiële praktijk verscheen in 2008, als deel 56 van de toenmalige Bankjuridische Reeks van NIBESVV. In de afgelopen tien jaar hebben zich op het terrein van de vermogensscheiding de nodige ontwikkelingen voorgedaan. Deze betreffen in het bijzonder de vermogensscheiding bij (bank) beleggingsondernemingen en beleggingsinstellingen. In deze tweede druk wordt uitvoerig op deze nieuwe ontwikkelingen ingegaan. In de bundel worden eerst de regels inzake vermogensscheiding bij beleggingsondernemingen en banken op een rijtje gezet en geanalyseerd. Dit geschiedt vanuit verschillende invalshoeken. Zo wordt de vermogensscheiding beschouwd vanuit het perspectief van achtereenvolgens de belegger, de bank, de CSD en de uitgevende instelling en vanuit een internationaal perspectief. Daarbij wordt ruimschoots aandacht besteed aan MiFID II, EMIR, de CSDverordening en natuurlijk de Wge. Vervolgens wordt de vermogensscheiding bij beleggingsinstellingen besproken. In dat verband komen de AIFMD en UCITS V aan de orde. De bundel bestaat uit bijdragen van verschillende auteurs die werkzaam zijn binnen het financiële recht en die specialist zijn op het gebied van de vermogensscheiding. Iedere auteur geeft vanuit zijn eigen achtergrond invulling aan het onderwerp van de vermogensscheiding.","14","Financieel Juridische Reeks","Vermogensscheiding in de financiële praktijk","31-10-2018","24-12-2020","Gewijzigd"
"Holthinrichs, D.B.","gereed","","","9789462511934","9789462511934","2018","","Paris","","399","Een onderzoek naar de reikwijdte van de vrije advocaatkeuze in rechtsbijstandverzekeringen","Zutphen","78.90","Final","","822","Privaatrecht","","","In dit proefschrift gaat de auteur in op de achtergrond en strekking van het recht van vrije advocaatkeuze, dat in de Nederlandse wet is opgenomen in artikel 4:67 lid 1 onder a Wft. Dit recht is gebaseerd op Europese Richtlijn 87/344/ EEG. Op 7 november 2013 heeft het Hof van Justitie van de EU inzake het arrest van verzekerde Sneller tegen DAS Nederlandse Rechtsbijstand Verzekeringsmaatschappij een ruime uitleg gegeven aan het recht van verzekerden om onder een rechtsbijstandverzekering hun rechtshulpverlener te kiezen wanneer sprake is van een gerechtelijke of administratieve procedure. De auteur gaat in op de achtergrond van het recht van vrije advocaatkeuze en de plaats die het inneemt in een pakket aan maatregelen dat de Europese regelgever heeft geïntroduceerd om belangenconflicten tussen verzekeraars en verzekerden te voorkomen en bestrijden. Tevens beschrijft hij de huidige status quo die in Nederland is ontstaan sinds het baanbrekende arrest van het Hof van Justitie van de EU van 2013. Dit proefschrift verschaft daarmee inzicht in de achtergrond van het recht van vrije advocaatkeuze maar biedt tevens aanknopingspunten ten behoeve van het vinden van een nieuwe balans tussen een betaalbare rechtsbijstandverzekering en een redelijke mate van keuzevrijheid bij het kiezen van een rechtshulpverlener.","15","ACIS-Serie","Vrijheid verzekerd?","26-11-2018","24-12-2020","Gewijzigd"
"Vliet, L.P.W. van|Loth, M.A.","gereed","","","9789462511927","9789462511927","2018","","Paris","","154","Hoever reikt het privaatrecht in het verleden?","Zutphen","37.16","Final","","822","Privaatrecht","","","Hoe gaan we om met historisch onrecht? Welke mogelijkheden en beperkingen biedt het recht? Of het nu gaat om het slavernijverleden, het postkoloniale verleden, of het misbruik in de Rooms-Katholieke Kerk, telkens rijst de vraag of onrecht in een min of meer ver verleden grond kan zijn voor aansprakelijkheid in het heden. Wat gestolen kunst betreft rijst de vraag of de eigenaar of zijn rechtsopvolgers eeuwig moeten kunnen revindiceren of dat aan die mogelijkheid door verjaring een einde moet worden gemaakt. In het eerste preadvies worden twee vragen onderzocht, namelijk de vraag naar het ‘wanneer’ van aansprakelijkheid (de vereisten), en die naar het ‘waarom’ (de legitimaties). Bron van inspiratie vormde de discussie over de ‘slavery reparations suits’ in de Verenigde Staten. De bevindingen leveren een beeld op van de variabelen van een succesvolle vordering op grond van historisch onrecht in onze rechtsorde. Het tweede preadvies laat zien dat de vraag of een verjaringstermijn moet lopen tegen een eigenaar die niet kan revindiceren zeer verschillend wordt beantwoord in de onderzochte rechtssystemen. De nadruk van het onderzoek ligt op de ratio van verjaring en de voor- en nadelen van het ontbreken van verjaringstermijnen voor gestolen kunst. Het is frappant dat bij het onderwerp ‘verjaring en gestolen kunst’ met goed verdedigbare argumenten tegengestelde standpunten te verdedigen zijn.","2018","Preadviezen Vereniging voor Burgerlijk Recht","Recht over tijd","07-12-2018","24-12-2020","Gewijzigd"
