"AUTEURSENAUTEURSFUNCTIES","DOCUMENTCODE","DRUK","EMBARGODATUM","ISBN13EAN","ISBNFOLIOBK","JAARVANUITGAVE","MEDIAPRODUCTFAMILY","NAAMVANUITGEVER","NUMMER","OMVANG","ONDERTITEL","PLAATSVANUITGAVE","PRIJS","PRODUCTSTATUS","PRODUCTTEKST","RUBRIEKCODE","RUBRIEKSOMSCHRIJVING","RUBRIEKSOMSCHRIJVING2","RUBRIEKSOMSCHRIJVING3","SAMENVATTINGABSTRACT","SERIENRCQREEKSNR","SERIETITELCQREEKSTITEL","TITEL","VERSCHIJNINGSDATUM","WIJZIGINGSDATUM","WIJZIGINGSSTATUS"
"Berends, A.J.","gereed","","","9789462511415","9789462511415","2017","","Paris","","332","","Zutphen","56.42","Final","","827","Ondernemingsrecht","","","Het aantal insolventieprocedures met internationale aspecten groeit alleen maar. Daarbij rijzen veel juridische vragen. Welke rechter is bevoegd? Welk recht is van toepassing, bijvoorbeeld op de bevoegdheden van de curator in een ander land, de verdeling van de boedel, zakelijke rechten, verrekening, eigendomsvoorbehoud, opzegging van overeenkomsten, de actio pauliana? In dit boek gaat de auteur in op deze en veel andere vragen. Voor intra-EU gevallen is op 26 juni 2017 de herziene Insolventieverordening in werking getreden. In deze nieuwe Verordening is veel jurisprudentie van het Hof van Justitie van de Europese Unie gecodificeerd. Daarnaast zijn enkele nieuwe onderwerpen geregeld, in het bijzonder met betrekking tot insolventie van groepen en de zogeheten synthetische procedure. Voor verhoudingen met landen die geen lid zijn van de Europese Unie stelt elke lidstaat zijn eigen regels op. In Nederland is het recht op dit punt in grote mate ontwikkeld door de Hoge Raad met recente jurisprudentie. Daarnaast hebben de Verenigde Naties een Modelwet geschreven, bij wijze van aanbeveling aan Staten over de gehele wereld om deze wet in hun eigen nationale regels op te nemen. Een aantal Staten, waaronder de Verenigde Staten, heeft dat gedaan. Dit is de tweede druk van dit boek. Alle drie de onderwerpen worden behandeld: de herziene EU-Verordening, de jurisprudentie van de Hoge Raad voor verhoudingen met derde landen en de VN-Modelwet. Mr. dr. A.J. Berends was destijds namens Nederland betrokken bij de onderhandelingen die hebben geleid tot de oorspronkelijke Insolventieverordening, alsook bij de onderhandelingen die hebben geleid tot de Modelwet van de Verenigde Naties. In 2005 is hij gepromoveerd op grensoverschrijdend insolventierecht (cum laude).","11","Financieel Juridische Reeks","Grensoverschrijdende insolventie","07-11-2017","24-12-2020","Gewijzigd"
"Bobeldijk, A.C.P.|Hees, J.J. van|Josephus Jitta, M.W.|Kluiver, H.J. de|Tollenaar, N.W.A.|Veder, P.M.|Verstijlen, F.M.J.|Vugt, M.H.F. van","gereed","","","9789462511507","9789462511507","2017","","Paris","","206","Beschouwingen over het Voorontwerp Wet homologatie onderhands akkoord ter voorkoming van faillissement","Zutphen","49.08","Final","","827","Ondernemingsrecht","","","De preadviezen van de Vereeniging Handelsrecht zijn dit jaar gewijd aan het 'Voorontwerp Wet homologatie onderhands akkoord ter voorkoming van faillissement (WHOA)'. Het voorontwerp strekt tot invoering van een regeling voor een pre-insolventieakkoord buiten het kader van een formele meeromvattende insolventieprocedure. Aan dit voorontwerp ging vooraf het 'Voorontwerp Wet continuïteit ondernemingen IIDit voorontwerp markeert een fundamentele vernieuwing van het recht die van groot belang is voor alle betrokkenen bij grote organisaties, zowel kapitaalverschaffers, crediteuren en werknemers. Deelonderwerpen en preadviseurs: De akkoordprocedure onder het Voorontwerp - Mr. dr. N.W.A. Tollenaar, advocaat bij RESOR te Amsterdam, Flankerende voorzieningen - Prof. mr. dr. F.M.J. Verstijlen, hoogleraar aan de Rijksuniversiteit Groningen, Vennootschaps- en effectenrechtelijke aspecten - Mr. M.W. Josephus Jitta, advocaat bij ENSPIGT te Amsterdam, Internationale aspecten - Prof. mr. dr. P.M. Veder, hoogleraar aan de Radboud Universiteit te Nijmegen en adviseur bij RESOR te Amsterdam en Prof. mr. dr. J.J. van Hees, advocaat bij RESOR te Amsterdam en hoogleraar aan de Radboud Universiteit te Nijmegen, Processuele aspecten bezien vanuit rechterlijk perspectief - Mr. M.H.F. van Vugt, rechter-commissaris te Utrecht en voorzitter van Recofa, Fiscale aspecten - Prof. mr. dr. A.C.P. Bobeldijk, hoogleraar vennootschapsbelasting aan Nyenrode Business Universiteit en tax partner bij Loyens & Loeff te Amsterdam","2017","Preadviezen Vereeniging Handelsrecht","Het dwangakkoord buiten faillissement","16-11-2017","24-12-2020","Gewijzigd"
"Drongelen, J. van|Klingeman, S.|Rijs, A.D.M. van","gereed","3","","9789462511293","9789462511293","2017","","Paris","","287","","Zutphen","25.23","Final","","825","Arbeids- en sociale zekerheidsrecht","","","Ontslag is in veel gevallen een ingrijpend gebeuren. De werknemer moet bij een (dreigend) ontslag op zoek naar een nieuwe werkkring en kan geconfronteerd worden met een al dan niet langdurige periode van werkloosheid. Dit kan onzekerheid, statusverlies en inkomensachteruitgang met zich brengen. Er moet dus ook niet al te lichtzinnig over ontslag worden gesproken. Er wordt wel eens een vergelijking gemaakt met een rouwproces om aan te geven wat het effect is van het (moeten) verwerken van een gedwongen ontslag, zeker als een werknemer tientallen jaren bij dezelfde werkgever werkzaam is geweest. Ook voor de werkgever is een ontslag geen eenvoudige opgave. Hij zet in de meeste gevallen de eerste stap om de arbeidsrelatie te beëindigen. Daarbij spelen uiteenlopende motieven een rol, bedrijfseconomische en bedrijfsorganisatorische motieven, in de werknemer zelf gelegen redenen en een verstoorde arbeidsrelatie. Bij bedrijfseconomische motieven moet de werkgever een keuze maken: welke werknemers blijven en wie wordt ontslagen? Welke procedure moet worden gevolgd? Als de werkgever niet oplet, kan het effectueren van het ontslag worden vertraagd en kan hij schadevergoeding moeten betalen. Ontslag heeft dus gevolgen voor zijn bedrijfsvoering en ondernemingsbeleid. Dit boek, de titel zegt het al, is geen theoretische beschouwing over het ontslagrecht. De doelstelling van het boek is zo nauw mogelijk te vertrekken vanuit en aan te sluiten bij situaties in de ontslagpraktijk. Mr. dr. J. van Drongelen: universitair hoofddocent Sociaal Recht en Sociale Politiek Universiteit van Tilburg. Mw. mr. S. Klingeman: advocaat bij Advocaten van nu te s'-Hertogenbosch. Mr. A.D.M. van Rijs: docent Sociaal Recht en Sociale Politiek Universiteit van Tilburg.","","","Het ontslagrecht in de praktijk","05-04-2017","24-12-2020","Gewijzigd"
"Groen, J.R.","gereed","","","9789462511453","9789462511453","2017","","Paris","","57","","Zutphen","22.94","Final","","820","Recht algemeen","","","In het jaar 2017 is de grondwetswijziging, die bekend is komen te staan als de 'onderwijspacificatie', precies honderd jaar oud. Het resultaat daarvan, neergelegd in artikel 23 Grondwet, is nog steeds een belangrijk baken voor de nationale rechtsverhoudingen in het onderwijs. Tegelijkertijd is artikel 23 Grondwet geen rustig bezit. Anno 2017 heeft Nederland een formeel sterk verzuild onderwijsstelsel, terwijl de samenleving in vergaande mate ontzuild en geseculariseerd is. In dit preadvies is de vraag aan de orde wat de betekenis is van artikel 23 Grondwet, honderd jaar na de totstandkoming van de onderwijspacificatie, in actuele vraagstukken van onderwijsbeleid en voor de toekomst van het onderwijsbestel. Omdat een goed begrip van de totstandkomingsgeschiedenis van artikel 23 Grondwet wezenlijk is voor een begrip van de juridische betekenis, wordt ingegaan op de historische achtergrond van de grondwetsbepaling. Nadat kort de grenzen van het internationale recht voor het nationale onderwijsbeleid worden verkend, worden enkele actuele vraagstukken die van betekenis zijn voor het stelsel van artikel 23 Grondwet aan de orde gesteld. Mr. dr. J.R. Groen is werkzaam als wetgevingsjurist bij het Ministerie van Veiligheid en Justitie. Groen promoveerde in 2017 aan de Erasmus University Rotterdam op een onderzoek naar de juridische betekenis van academische vrijheid. Hij schreef het preadvies op persoonlijke titel.","","Preadviezen Christen Juristen Vereniging","Honderd jaar onderwijspacificatie","03-10-2017","24-12-2020","Gewijzigd"
"Drongelen, J. van|Fase, W.J.P.M.","gereed","8","","9789462511347","9789462511347","2017","","Paris","","408","De overeenkomsten tot het verrichten van arbeid – Vakantie en verlof","Zutphen","40.70","Final","","825","Arbeids- en sociale zekerheidsrecht","","","Dit boek is het eerste deel van een drieluik, waarin alle facetten van de individuele arbeidsverhouding worden behandeld. Het is daarmee een van de meest uitgebreide uitgaven op dit gebied in de Nederlandse rechtsliteratuur. In Individueel Arbeidsrecht Deel 1 komen overeenkomsten tot het verrichten van arbeid en vakantie en verlof aan de orde. Veel aandacht is geschonken aan parlementaire stukken, literatuur en rechtspraak, zodat deze uitgave naast een leerboek ook een zeer nuttig naslagwerk is voor de praktijk. Om de toegankelijkheid van de uitgave te vergroten is een fijnmazige hoofdstukindeling gehanteerd, zodat een bepaald onderwerp snel is terug te vinden. Voor zover dit nuttig is, wordt bij de onderwerpsgewijze behandeling verwezen naar andere onderdelen van het boek. Mr. dr. J. van Drongelen is universitair hoofddocent Vakgroep Sociaal Recht en Sociale Politiek van de Universiteit van Tilburg.","1","Individueel arbeidsrecht","Individueel Arbeidsrecht Deel 1","19-01-2017","24-12-2020","Gewijzigd"
"Drongelen, J. van|Fase, W.J.P.M.|Jellinghaus, S.F.H.","gereed","6","","9789462511354","9789462511354","2017","","Paris","","298","Bijzondere bedingen, Aansprakelijkheid, Gelijke behandeling, Overgang van de onderneming","Zutphen","35.78","Final","","825","Arbeids- en sociale zekerheidsrecht","","","Dit boek is het tweede deel van een drieluik, waarin alle facetten van de individuele arbeidsverhouding worden behandeld. Het is daarmee een van de meest uitgebreide uitgaven op dit gebied in de Nederlandse rechtsliteratuur. In Individueel Arbeidsrecht Deel 2 komen de bijzondere bedingen, de aansprakelijkheid van de werkgever in verband met arbeidsongevallen en beroepsziekten, de werknemersaansprakelijkheid voor door hem aan de werkgever of een derde toegebrachte schade, de gelijke behandelingsaspecten en de overgang van een onderneming aan de orde. Veel aandacht is geschonken aan parlementaire stukken, literatuur en rechtspraak, zodat de uitgave naast een leerboek ook een zeer nuttig naslagwerk is voor de praktijk. Mr. dr. J. van Drongelen: universitair hoofddocent Vakgroep Sociaal Recht en Sociale Politiek van de Universiteit van Tilburg. Mr. dr. S.F.H. Jellinghaus: advocaat en nmi mediator bij De Voort Advocaten/mediators te Tilburg en universitair docent Vakgroep Sociaal Recht en Sociale Politiek.van de Universiteit van Tilburg.","2","Individueel arbeidsrecht","Individueel Arbeidsrecht Deel 2","11-07-2017","24-12-2020","Gewijzigd"
"Drongelen, J. van|Fase, W.J.P.M.|Jellinghaus, S.F.H.","gereed","7","","9789462511361","9789462511361","2017","","Paris","","378","Ontslagrecht","Zutphen","40.70","Final","","825","Arbeids- en sociale zekerheidsrecht","","","Dit boek is het derde deel van een drieluik waarin alle facetten van de individuele arbeidsverhouding worden behandeld. Het is daarmee een van de meest uitgebreide uitgaven op dit gebied in de Nederlandse rechtsliteratuur. In Individueel arbeidsrecht Deel 3 komt het ontslagrecht aan de orde. Het ontslagrecht is met ingang van 1 juli 2015 door de Wet werk en zekerheid ingrijpend gewijzigd. Deze wet en de daarop berustende nadere voorschriften worden in dit boek uitgebreid behandeld en waar nodig van commentaar voorzien. Aan bod komen allereerst de beëindiging met wederzijds goedvinden (beëindigingsovereenkomst) en van rechtswege. Vervolgens worden de ontslaggronden, de beëindiging door opzegging al dan niet met toestemming van het UWV of cao-ontslagcommissie, de beëindiging door onverwijlde opzegging wegens dringende reden (het ontslag op staande voet) en de opzeg-/beëindigingsverboden behandeld. Daarna komen de ontbinding door de kantonrechter, het herstel van de arbeidsovereenkomst en de vergoedingen in samenhang met het ontslag aan de orde. Het ontslagrecht wordt afgesloten door procedurele aspecten (verzoekschrift, hoger beroep en cassatie). Als laatste wordt het getuigschrift behandeld. Veel aandacht is geschonken aan parlementaire stukken, literatuur en rechtspraak, zodat de uitgave naast een leerboek ook een zeer nuttig naslagwerk is voor de praktijk. Mr. dr. J. van Drongelen: universitair hoofddocent Vakgroep Sociaal Recht en Sociale Politiek van de Universiteit van Tilburg. Mr. dr. S.F.H. Jellinghaus: advocaat en nmi mediator bij De Voort Advocaten | Mediators in Tilburg en universitair docent Vakgroep Sociaal Recht en Sociale Politiek van de Universiteit van Tilburg.","3","Individueel arbeidsrecht","Individueel Arbeidsrecht Deel 3","29-06-2017","24-12-2020","Gewijzigd"
"Scholten, A.A.","gereed","","","9789462511460","9789462511460","2017","","Paris","","192","","Zutphen","30.73","Final","","820","Recht algemeen","","","Deel 10 van de Financieel Juridische Reeks gaat over de juridische aspecten van contant geld. Met de introductie van de euro is Europese wet- en regelgeving een grote rol gaan spelen, een rol die tot nu toe weinig aandacht heeft gekregen. De verschuiving van contant naar elektronisch betalen roept nieuwe vragen op over de positie van contant geld als wettig betaalmiddel. Beide aspecten krijgen veel aandacht in dit boek. De auteur volgt in zijn boek de kringloop van contant geld: van de uitgifte van bankbiljetten en munten door de officiële autoriteiten tot het gebruik van contant geld als betaalmiddel, eventuele vernietiging en nieuwe ontwerpen. Bijzondere onderwerpen zoals valsemunterij en 'nepgeld' komen uitgebreid aan bod. Dit boek is een aanrader voor eenieder die beroepshalve of uit nieuwsgierigheid belangstelling heeft voor de juridische positie van contant geld Mr. drs. A.A. Scholten is sinds 1980 werkzaam bij De Nederlandsche Bank (DNB), waar hij een groot aantal functies heeft vervuld. Enige jaren was hij gedetacheerd bij het Internationaal Monetair Fonds in Washington D.C. en bij de Europese Centrale Bank (ECB). Sinds 1997 is hij betrokken bij de ontwikkeling van het beleid van DNB ten aanzien van bankbiljetten en munten. Hij vervulde een centrale rol bij de introductie van de contante euro in 2002 en was vele jaren namens DNB lid van het Banknote Committee van de ECB, waar besluitvorming door de ECB Governing Council op het terrein van contant geld wordt voorbereid. Door zijn ervaring is Bram Scholten in een unieke positie om inzicht te geven in de juridische aspecten van contant geld.","10","Financieel Juridische Reeks","Juridische aspecten van contant geld","25-10-2017","24-12-2020","Gewijzigd"
"Gronden, J.W. van de ","gereed","","","9789462511392","9789462511392","2017","","Paris","","485","","Zutphen","50.92","Final","","828","Internationaal (publiek)recht","","","Het mededingingsrecht behoort tot de kern van het beleid van de Europese Unie. Europese integratie is voor een groot gedeelte marktintegratie. Rivaliteit tussen onderneming in de Europese arena moet leiden tot meer consumentenwelvaart op de interne markt van de EU. De toepassing en handhaving van het EU-mededingingsrecht zijn krachtig ter hand genomen door de Europese Commissie in de loop van de jaren. Toch staan de Europese regels voor de concurrentie niet op zichzelf. Ook de lidstaten hebben mededingingswetgeving aangenomen. Nationale mededingingsautoriteiten hebben aansluiting gevonden bij de kopgroep van de Commissie. In Nederland geldt de Mededingingswet, die naar Europees model is vormgegeven en door de ACM wordt gehandhaafd. Het Europees en Nederlands mededingingsrecht is sterk vervlochten met elkaar. Dit recht kan alleen beoefend worden door zowel kennis te nemen van de Europese als nationale dimensie ervan. In dit boek worden daarom beide dimensies belicht en onderworpen aan een analyse. Belangrijke concepten, begrippen en regels worden uitgelegd en verdiept. Het boek kan daarom gebruikt worden voor een gevorderd bachelor- of mastervak. Prof. mr. J.W. van de Gronden is hoogleraar Europees recht aan de Radboud Universiteit Nijmegen. Daarnaast is hij staatsraad i.b.d. bij de Afdeling Bestuursrechtspraak van de Raad van State.","","","Mededingingsrecht in de EU en Nederland","08-08-2017","24-12-2020","Gewijzigd"
"Dijk, A.A. van","gereed","","","9789462511422","9789462511422","2017","","Paris","","557","Een analyse van doodslag in het verkeer","Zutphen","50.92","Final","","824","Strafrecht en strafprocesrecht","","","In dit boek wordt het fenomeen (poging tot) doodslag in het verkeer vanuit verschillende perspectieven geanalyseerd. Het boek bevat om te beginnen een traditionele juridische analyse van de rechtspraak ten aanzien van (poging tot) doodslag in het verkeer en een aantal voor dit thema relevante leerstukken. Het boek bevat daarnaast een psychologische component. De auteur introduceert een rationele keuzetheorie, waarin cognities, volities en kansen psychisch geïntegreerd worden om de actor in de gelegenheid te stellen te kiezen voor de optie die de wenselijkheid maximaliseert. Ten slotte is een deel van het boek gewijd aan een kritische evaluatie van de feitenrechtspraak. De auteur benadert de rechtspraak met minder distantie dan gebruikelijk is in de rechtswetenschap en neemt in wezen plaats op de stoel van de rechter.","","","Opzet, kans en keuzes","02-10-2017","24-12-2020","Gewijzigd"
"Lodder, A.R.","gereed","","","9789462511408","9789462511408","2017","","Paris","","188","48 nieuwe verhalen over recht en onrecht op Facebook, YouTube, Marktplaats, Twitter, The Pirate Bay en andere plekken","Zutphen","22.02","Final","","820","Recht algemeen","","","Toegang tot het internet was twintig jaar geleden voorbehouden aan een nog kleine groep die via een modem inbelde. Inmiddels staan wij en onze omgeving continu in contact met het internet. Televisie is goeddeels vervangen door on demand streamingdiensten als Netflix, muziek luisteren we via YouTube en Spotify, tekstberichten versturen we via WhatsApp, Snapchat, enzovoort. Het internet is een kritische infrastructuur en tegelijkertijd zeer kwetsbaar voor aanvallen van criminelen en overheden. Onveranderd is dat er op het internet grenzen zijn: niet alles kan gezegd, gedeeld of aangeboden worden. De grenzen zijn niet altijd bekend of duidelijk. In 48 verhalen worden verschillende onderwerpen zoals privacy, auteursrecht en strafrecht behandeld. Iedereen zal na het lezen van deze veelal vermakelijke verhalen inzien dat internetrecht bestaat en inzicht hebben in wat recht en onrecht op internet is. Arno R. Lodder is hoogleraar internet governance and regulation aan de Vrije Universiteit in Amsterdam en Of Counsel bij SOLV advocaten. In zijn onderzoek en onderwijs richt hij zich op onderwerpen op het snijvlak van recht en internet, zoals privacy, security, vrijheid van meningsuiting, cybercrime alsmede verschijnselen als big data, profilering en het internet van dingen.","","","Over de grenzen van het internet II","28-08-2017","24-12-2020","Gewijzigd"
"Broekveldt, L.P.","gereed","","","9789462511255","9789462511255","2017","","Paris","","89","","Zutphen","25.69","Final","","822","Privaatrecht","","","In deze monografie wordt een onderscheid gemaakt tussen eigenlijke en oneigenlijke – ook wel aangeduid als zuivere en onzuivere – conservatoire vreemdelingenbeslagen. In art. 767 Rv is het eigenlijke (conservatoir) vreemdelingenbeslag vormgegeven, in zijn functie van rechtsmachtscheppend beslag en komt het louter in de conservatoire vorm voor. Beslissend is of de schuldenaar, die als regel een ‘vreemdeling’ zal zijn, over hier te lande voor beslag vatbare vermogensbestanddelen beschikt. In een zodanig geval, dat zich niet heel regelmatig voordoet (maar tegenwoordig wel vaker), zal een Nederlandse of een buitenlandse schuldeiser bij de Nederlandse rechter een executoriale titel tegen die ‘vreemdeling’ kunnen verkrijgen. In de meeste gevallen zal het daarbij gaan om betaling van een geldsom, maar het panorama is daartoe niet beperkt (vgl. art. 765 Rv). Zo is het bijvoorbeeld ook mogelijk dat een vreemdelingenbeslag wordt gelegd tot levering van een goed op naam, zoals een onroerende zaak. Echter, indien de schuldeiser op grond van een forumkeuzebeding of een bevoegdheidsverdrag in een ander land moet procederen, dan zal het van de aanwezigheid van internationale executieverdragen afhangen of die schuldeiser daarna dat vreemde vonnis in Nederland ten uitvoer kan leggen. Ook in dat processuele kader zal er een conservatoir beslag op de activa van de schuldenaar kunnen worden gelegd, maar dan is géén sprake van een zuiver conservatoir vreemdelingenbeslag, maar juist van de onzuivere variant ervan. Deze verschillende mogelijkheden, waaronder met name ook die ex art. 431 lid 2 Rv – ingevolge waarvan op grond van het buitenlandse vonnis het geding opnieuw bij de Nederlandse rechter aanhangig kan worden gemaakt –, zullen alle in deze monografie de revue passeren. Een aantal recente arresten van de Hoge Raad kon hierbij de nodige steun en inspiratie bieden, ook omdat het hier gaat om een niet al te toegankelijk rechtsgebied dat in de gangbare literatuur over het beslag- en procesrecht niet ruim aandacht heeft gekregen.","","","Over eigenlijke en oneigenlijke conservatoire vreemdelingenbeslagen","07-03-2017","24-12-2020","Gewijzigd"
"Tigelaar, L.B.A.","gereed","","","9789462511323","9789462511323","2017","","Paris","","266","","Zutphen","54.13","Final","","820","Recht algemeen","","","Verschillende Europese richtlijnen die de consument beogen te beschermen, bevatten informatieplichten. Een van deze richtlijnen is de Richtlijn consumentenrechten (2011/83/EU). Op grond daarvan zijn ondernemers verplicht aan consumenten informatie te verstrekken als zij een overeenkomst sluiten in een fysieke winkel, buiten een verkoopruimte of op afstand. Evenals andere richtlijnen uit het consumentenacquis laat de Richtlijn consumentenrechten de sanctionering van een schending van deze informatieplichten grotendeels over aan de lidstaten. In dit onderzoek wordt nagegaan hoe de sanctionering van deze informatieplichten eruitziet in Duitsland, Engeland en Nederland. Dit gebeurt aan de hand van de volgende vraag: hoe wordt een schending van informatieplichten uit de Richtlijn consumentenrechten in Duitsland, Engeland en Nederland gesanctioneerd en wie hanteren deze sancties en waarom zij? Deze vraag wordt beantwoord aan de hand van drie delen. In deel I van dit onderzoek wordt stilgestaan bij de informatieplichten uit de Richtlijn consumentenrechten en hun doel. In deel II wordt ingegaan op de sancties die kunnen worden toegepast in de drie rechtsstelsels bij een schending van een informatieplicht en wordt ingegaan op degenen die ze hanteren. In deel III wordt bekeken welke keuzes in Duitsland, Engeland en Nederland zijn gemaakt bij de sanctionering van oneerlijke handelspraktijken en de handhaving van het consumentenrecht. Leonieke Tigelaar (1988) heeft in 2009 haar bachelor Nederlands recht (cum laude) en in 2011 haar master Nederlands recht (Togamaster, specialisatie Privaatrecht) behaald aan de Rijksuniversiteit Groningen. Zij is als universitair docent verbonden aan de Rijksuniversiteit.","","","Sanctionering van informatieplichten uit de Richtlijn consumentenrechten","08-06-2017","24-12-2020","Gewijzigd"
"Niessen, S.","gereed","","","9789462511491","9789462511491","2017","","Paris","","337","","Zutphen","61.01","Final","","822","Privaatrecht","","","The legal position of the terminal operator changes by the integration of the carriage of goods between the sea port and the hinterland into his service profile. The terminal operator performs a wide variety of obligations, including loading and discharging, stacking, warehousing, measuring, weighing and carrying goods within and beyond the terminal's premises. These obligations fall into different categories of contracts for which the law provides specific rules, i.e. a contract of carriage, a contract of deposit and a service contract. Some of these obligations might be subject to mandatory provisions derived from applicable national legal systems or uniform private law conventions. This book examines how to determine the applicable rules to the terminal operator's mixed contracts. This serves a practical purpose as one of themain differences between the applicable legal regimes is the terminal operator's liabilities towards third parties such as cargo owners or ship owners who do not have a contractual relation with the terminal operator. Susan Niessen is a Ph.D.-candidate at the Erasmus School of Law of the Erasmus University Rotterdam and a law clerk of the Supreme Court of the Netherlands","23","NTHR-Reeks","The Legal Position of Terminal Operators in Hinterland Networks","21-12-2017","24-12-2020","Gewijzigd"
